[
    {
        "raw-address": "<redacted-address>",
        "raw-full-name": "<redacted-name>",
        "raw-telephone": "<redacted-phone>",
        "unreliability": "RELIABLE"
    },
    {
        "raw-address": "<redacted-address>",
        "raw-full-name": "<redacted-name>",
        "raw-telephone": "<redacted-phone>",
        "unreliability": "RELIABLE"
    }
]
